{
    "id": "msc62_estadistica_descriptiva",
    "title": "Estadística descriptiva",
    "pilar": "06_estocastica_incertidumbre",
    "msc_code": "62-01",
    "tags": [
        "estadistica",
        "datos",
        "medidas",
        "tendencia"
    ],
    "nivel": "intro",
    "updated": "2026-05-24",
    "status": "stable"
}