{
    "id": "msc26_calculo_multivariable",
    "title": "Cálculo multivariable y vectorial",
    "pilar": "03_analisis_continuidad",
    "msc_code": "26-01",
    "tags": [
        "multivariable",
        "vectores",
        "gradiente",
        "integrales_multiples"
    ],
    "nivel": "intermedio",
    "updated": "2026-04-26",
    "status": "stable"
}