{
    "id": "msc26_calculo_diferencial",
    "title": "Cálculo Diferencial",
    "pilar": "03_analisis_continuidad",
    "msc_code": "26-XX",
    "tags": [
        "derivadas",
        "optimizacion",
        "diferencial"
    ],
    "nivel": "intro",
    "updated": "2026-05-24",
    "status": "stable"
}